number,value,datetime_start,datetime_complete,duration,params_alpha,params_batch_size,params_bottleneck_dim,params_channels,params_dropout,params_lr,state
0,0.3021983467042446,2026-09-29 15:17:53.211494,2026-09-29 15:18:11.753765,0 days 00:00:18.542271,0.8243319806003162,16,256,c32,0.14548647782429913,0.0007106591851092234,COMPLETE
1,0.3220924027264118,2026-09-29 15:18:11.774607,2026-09-29 15:18:33.653632,0 days 00:00:21.879025,0.7888819710447601,64,256,c48,0.06841049763255538,0.0004891706203866443,COMPLETE
2,0.3143049068748951,2026-09-29 15:18:33.668158,2026-09-29 15:18:46.032828,0 days 00:00:12.364670,0.7131747698841178,32,256,c16,0.014650817100957579,0.00047511094677356254,COMPLETE
3,0.34226683527231216,2026-09-29 15:18:46.047167,2026-09-29 15:18:53.872040,0 days 00:00:07.824873,0.7813496175208359,32,32,c32,0.14543769416468377,0.000826558789485323,PRUNED
4,0.4519573822617531,2026-09-29 15:18:53.885062,2026-09-29 15:19:01.131638,0 days 00:00:07.246576,0.4107008822655356,64,256,c48,0.05351299900403839,0.0026098779385539945,PRUNED
5,0.4329228326678276,2026-09-29 15:19:01.145513,2026-09-29 15:19:05.239193,0 days 00:00:04.093680,0.2555334888005678,32,32,c16,0.11569055200289186,0.0010466882235417663,PRUNED
6,0.4047305956482887,2026-09-29 15:19:05.252749,2026-09-29 15:19:12.726066,0 days 00:00:07.473317,0.2896956844537263,32,32,c48,0.07083223877429239,0.0006848366327971538,PRUNED
7,0.3969781994819641,2026-09-29 15:19:12.741511,2026-09-29 15:19:20.009228,0 days 00:00:07.267717,0.5814280183735271,64,64,c48,0.047153397161449,0.0015501225780069814,PRUNED
8,0.4872899502515793,2026-09-29 15:19:20.021687,2026-09-29 15:19:24.076898,0 days 00:00:04.055211,0.8027540576743359,64,128,c16,0.13071908852815764,0.0024248659134486093,PRUNED
9,0.2621868886053562,2026-09-29 15:19:24.090250,2026-09-29 15:19:47.497174,0 days 00:00:23.406924,0.5830604769331743,16,32,c48,0.0010428195796786054,0.0004609897972837507,COMPLETE
10,0.27316171675920486,2026-09-29 15:19:47.514628,2026-09-29 15:20:10.883619,0 days 00:00:23.368991,0.5558383606840863,16,64,c48,0.003124537126844043,0.0003221771184740563,COMPLETE
11,0.2680605612695217,2026-09-29 15:20:10.898214,2026-09-29 15:20:34.232972,0 days 00:00:23.334758,0.5330519019714657,16,64,c48,0.0013243272589188318,0.0003109682534027553,COMPLETE
